,id,sentence,normalized_sent_attention,emotion,tags
129,f000035,"supply remains constrained, particularly at the value end of our product range.",0.36860056,Happy,client computing group quarter revenue 
130,f000035,"we are working closely with our customers to align demand with available supply, while we add capacity.",0.368661827,Happy,client computing group quarter revenue 
131,f000035,and we expect supply demand balance to improve by midyear.,0.368633701,Happy,client computing group quarter revenue 
132,f000035,"client adjacencies grew 45% year-over-year, driven primarily by increased modem share gains.",0.368714857,Happy,client computing group quarter revenue 
133,f000035,though modem revenue fell significantly below our expectations as a result of weaker smartphone demand.,0.369890399,Happy,client computing group quarter revenue 
134,f000036,our operating profit grew 402 million year-over-year with operating margin up 1 point.,0.43062029,Happy,business acquisitions cash flow generation 
135,f000036,"while our pc volumes were down 2%, our leadership product performance and segmentation contributed to strong mix.",0.466177338,Happy,business acquisitions cash flow generation 
136,f000036,the investments we have made in the business organically in two acquisitions are delivering excellent cash flow generation.,0.515112051,Happy,business acquisitions cash flow generation 
137,f000036,"for 2018, we generated $29.4 billion in cash from operations.",0.401847047,Happy,business acquisitions cash flow generation 
138,f000036,"we invested $15.2 billion in capital expenditures and delivered $14.3 billion in free cash flow, up 38% year-on-year and closing the gap versus eps by 4.5 points.",0.432108565,Happy,business acquisitions cash flow generation 
139,f000036,"during this period, we returned the 114% of our free cash flow to our shareholders.",0.372464645,Happy,business acquisitions cash flow generation 
140,f000036,buybacks totaled $10.7 billion and dividends totaled $5.5 billion.,0.369674483,Happy,business acquisitions cash flow generation 
141,f000036,"in addition, settlements of our convertible debt reduced fully diluted shares by $40 million.",0.368835814,Happy,business acquisitions cash flow generation 
142,f000037,"to wrap-up with our full year results, we ended 2018 our 50th anniversary year with our third consecutive year of record results.",0.47623722,Happy,revenue year growth data businesses 
143,f000037,"revenue of $70.8 billion up 13% year-on-year driven by 20% growth in our data centric businesses, and 9% growth in our pc centric businesses.",0.699098096,Happy,revenue year growth data businesses 
144,f000037,"we started the year in january and expecting to generate $65 billion in revenue, 30% operating margin, and $3.55 in eps.",0.392712026,Happy,revenue year growth data businesses 
145,f000037,the growth that we and the industry have seen has been remarkable.,0.374377249,Happy,revenue year growth data businesses 
146,f000037,we ended the year approximately $6 billion higher in revenue with operating margin of 35% and $4.58 in eps.,0.374176897,Happy,revenue year growth data businesses 
147,f000038,operating income of $25 billion was up 25% on strong execution across the businesses and disciplined spending.,0.843287019,Analytical,income execution businesses spending 
148,f000038,"in october, we provided a preview of our outlook for 2019. at the time, we described a combination of tailwinds and headwinds that were balanced.",0.377396594,Analytical,income execution businesses spending 
149,f000038,"the tailwinds were in expanded and growing tam, products momentum and business mix.",0.408659567,Analytical,income execution businesses spending 
150,f000038,"the headwinds were tougher compares following an especially strong 2018, and increasingly competitive environment and global trade.",0.38280843,Analytical,income execution businesses spending 
151,f000039,"since that time, trade and macro concerns, especially in china have intensified.",0.471823671,Analytical,headwinds expectations margin percentage forecast 
152,f000039,cloud service providers shifted from building capacity to absorbing capacity and the demand pricing environment has further deteriorated.,0.475360394,Analytical,headwinds expectations margin percentage forecast 
153,f000039,those incremental headwinds are impacting our revenue expectations and slightly reducing our operating margin percentage forecast.,0.505010535,Analytical,headwinds expectations margin percentage forecast 
154,f000039,the remaining factors are roughly consistent with our october assessment.,0.439555174,Analytical,headwinds expectations margin percentage forecast 
155,f000040,"now, turning to our outlook for 2019. we expect 2019 to be another record year for us as the worlds appetite for the analysis, transmission and storage of data continues to grow.",0.949422166,Happy,outlook worlds analysis transmission storage 
156,f000040,"we are forecasting revenue of approximately $71.5 billion, up 1% year-on-year and operating margin of approximately 34%, down less than a point year-on-year.",0.384474857,Happy,outlook worlds analysis transmission storage 
157,f000040,"we expect a modest decrease in gross margin percentage, driven by the 10 nanometer ramp and the growth of our adjacencies.",0.369423477,Happy,outlook worlds analysis transmission storage 
158,f000040,this will be partially offset by increasing opex leverage as we continue to make thoughtful trade-offs and invest in r&d that will accelerate our growth and profitability.,0.369202601,Happy,outlook worlds analysis transmission storage 
159,f000041,we expect the full year tax rate to be approximately 13.5% following several beneficial discrete events in 2018 and we expect eps of $4.60.,0.453215203,Happy,capital expenditures logic memory 
160,f000041,we expect gross capital expenditures of $15.5 billion with logic spending up and memory spending down.,0.566588897,Happy,capital expenditures logic memory 
161,f000041,"the increase in logic capex reflects our effort to meet our customers needs and avoid constraining their growth, while our investment in memory is focused on the sit up of our independent technology development facility in new mexico.",0.477967143,Happy,capital expenditures logic memory 
162,f000041,"and finally, we expect free cash flow of $16 billion, an increase of approximately 12%.",0.405644864,Happy,capital expenditures logic memory 
163,f000042,"as we look to the first quarter of 2019, we are forecasting revenue of approximately $16 billion flat year-on-year excluding wind river.",0.501821885,Happy,revenues digits modems share data 
164,f000042,we expect pc centric revenues to be up low single digits on higher modems share and data centric revenues to be down low single digits on broad weakness in data center and continued nand pricing pressure.,0.724326904,Happy,revenues digits modems share data 
165,f000042,"we expect operating margin of 29% down 1point year-over-year with a decline in gross margin as a result of the 10 nanometer ramp and the growth of adjacencies, partially offset by increased spending leverage.",0.369667486,Happy,revenues digits modems share data 
166,f000042,we expect eps of $0.87 flat year-on-year.,0.370528046,Happy,revenues digits modems share data 
167,f000043,we expect 2019 to be our fourth to record year in a row.,0.512405846,Happy,years intel company data 
168,f000043,we feel great about where we are and where were going.,0.379389988,Happy,years intel company data 
169,f000043,"five years ago, we set out to transform intel from a pc centric company to a data centric company.",0.57248584,Happy,years intel company data 
170,f000043,"today, our strategy, products and people, are delivering on that ambition with strong growth, record results and the largest tam opportunity in the companys history.",0.447354554,Happy,years intel company data 
171,f000044,"ive been inspired and humbled time and time again by our employees commitment to this company, their colleagues and our customers, and were just getting started.",0.816417158,Happy,ive employees company colleagues customers 
172,f000044,"i am convinced the board will close on a new ceo in the near future and i believe the management team, myself and 107,000 employees will rally behind him or her to take this company to a whole new level.",0.448466597,Happy,ive employees company colleagues customers 
173,f000044,"in the meantime, we will not be distracted by the board.",0.369631361,Happy,ive employees company colleagues customers 
174,f000045,"with that, let me turn it over back to mark and well get to your questions.",1,Neutral,mark questions 
175,f000046,"thank you, bob.",0.471847793,Neutral,operator questioner 
176,f000046,"moving on now to the q&a as is our normal practice, we would ask each participant to ask just one question.",0.482724447,Neutral,operator questioner 
177,f000046,"operator, please introduce our first questioner.",0.59416876,Neutral,operator questioner 
